{
  "id": "sabah-piano-chorus-003",
  "title": "Sabah chorus — Piano 3: Singing guide tones",
  "tempo": 95,
  "timeSignature": "4/4",
  "measures": [
    { "chord": "Cmaj7", "events": [
      { "type": "rest", "duration": 4 },
      { "type": "chord", "notes": ["E4", "B4"], "duration": 4 },
      { "type": "chord", "notes": ["G4", "D5"], "duration": 4 },
      { "type": "rest", "duration": 4 }
    ] },
    { "chord": "B", "events": [
      { "type": "rest", "duration": 4 },
      { "type": "chord", "notes": ["D#4", "B4"], "duration": 4 },
      { "type": "chord", "notes": ["F#4", "D#5"], "duration": 4 },
      { "type": "rest", "duration": 4 }
    ] },
    { "chord": "Em7", "events": [
      { "type": "rest", "duration": 4 },
      { "type": "chord", "notes": ["E4", "B4"], "duration": 4 },
      { "type": "chord", "notes": ["G4", "D5"], "duration": 4 },
      { "type": "rest", "duration": 4 }
    ] },
    { "chord": "Bm7", "events": [
      { "type": "rest", "duration": 8 },
      { "type": "chord", "notes": ["D4", "A4"], "duration": 4 },
      { "type": "chord", "notes": ["F#4", "B4"], "duration": 4 }
    ] },
    { "chord": "Am7", "events": [
      { "type": "chord", "notes": ["E4", "G4"], "duration": 4 },
      { "type": "rest", "duration": 4 },
      { "type": "chord", "notes": ["C4", "G4"], "duration": 4 },
      { "type": "rest", "duration": 4 }
    ] },
    { "chord": "Bm7", "events": [
      { "type": "rest", "duration": 4 },
      { "type": "chord", "notes": ["D4", "A4"], "duration": 4 },
      { "type": "chord", "notes": ["F#4", "B4"], "duration": 4 },
      { "type": "rest", "duration": 4 }
    ] },
    { "chord": "Cmaj7", "events": [
      { "type": "rest", "duration": 4 },
      { "type": "chord", "notes": ["E4", "B4"], "duration": 4 },
      { "type": "chord", "notes": ["G4", "D5"], "duration": 4 },
      { "type": "rest", "duration": 4 }
    ] },
    { "chord": "D7", "events": [
      { "type": "rest", "duration": 4 },
      { "type": "chord", "notes": ["F#4", "C5"], "duration": 4 },
      { "type": "chord", "notes": ["A4", "D5"], "duration": 4 },
      { "type": "rest", "duration": 4 }
    ] }
  ]
}
